{
  "$schema": "https://json-schema.org/draft/2020-12/schema",
  "additionalProperties": true,
  "properties": {
    "actor_type": {
      "enum": [
        "user",
        "companion",
        "import_tool",
        "sync_engine",
        "migration"
      ],
      "type": "string"
    },
    "app_version": {
      "type": [
        "string",
        "null"
      ]
    },
    "card_id": {
      "type": [
        "string",
        "null"
      ]
    },
    "content_hash": {
      "type": "string"
    },
    "created_at": {
      "type": "string"
    },
    "deck_id": {
      "type": [
        "string",
        "null"
      ]
    },
    "deleted_at": {
      "type": [
        "string",
        "null"
      ]
    },
    "device_id": {
      "type": "string"
    },
    "duration_ms": {
      "type": [
        "integer",
        "null"
      ]
    },
    "event_id": {
      "type": "string"
    },
    "event_type": {
      "enum": [
        "session_started",
        "card_shown",
        "card_answered",
        "card_skipped",
        "session_ended",
        "stats_recomputed",
        "deck_created",
        "deck_updated",
        "card_created",
        "card_updated",
        "card_deleted",
        "sync_conflict_recorded"
      ],
      "type": "string"
    },
    "happened_at": {
      "type": "string"
    },
    "owner_subject_hash": {
      "type": [
        "string",
        "null"
      ]
    },
    "payload_hash": {
      "type": [
        "string",
        "null"
      ]
    },
    "payload_ref": {
      "type": [
        "string",
        "null"
      ]
    },
    "previous_hash": {
      "type": [
        "string",
        "null"
      ]
    },
    "record_id": {
      "type": "string"
    },
    "record_type": {
      "const": "study_history_event",
      "type": "string"
    },
    "result": {
      "type": [
        "string",
        "null"
      ]
    },
    "revision": {
      "type": [
        "integer",
        "string"
      ]
    },
    "schema_version": {
      "type": "string"
    },
    "session_id": {
      "type": [
        "string",
        "null"
      ]
    },
    "source": {
      "enum": [
        "apc_native",
        "anki_local_import",
        "anki_browser_local",
        "companion_session",
        "manual_edit",
        "sync_merge",
        "sync_engine",
        "migration"
      ],
      "type": "string"
    },
    "source_type": {
      "enum": [
        "apc_native",
        "anki_browser_local",
        "companion_generated",
        "manual_edit",
        "sync_merge"
      ],
      "type": "string"
    },
    "updated_at": {
      "type": "string"
    }
  },
  "required": [
    "schema_version",
    "record_type",
    "record_id",
    "created_at",
    "updated_at",
    "device_id",
    "revision",
    "source",
    "content_hash",
    "event_id",
    "event_type",
    "happened_at",
    "actor_type",
    "source_type"
  ],
  "title": "APC GoogleSync Study History Event",
  "type": "object",
  "x_apc_scope": "local_schema_validation_only",
  "x_apc_stage": "17K-Z-R4",
  "x_no_drive_writes": true,
  "x_no_oauth": true
}
