{
  "actor_type": "user",
  "app_version": "stage-17k-z-r4",
  "card_id": null,
  "content_hash": "hash_example",
  "created_at": "2026-06-29T00:00:00Z",
  "deck_id": "deck_example",
  "deleted_at": null,
  "device_id": "device_example",
  "duration_ms": 600000,
  "event_id": "history_event_example",
  "event_type": "session_ended",
  "happened_at": "2026-06-29T00:10:00Z",
  "owner_subject_hash": "subject_hash_example",
  "payload_hash": "payload_hash_example",
  "payload_ref": "study/sessions/2026/06/session_example.apc.json",
  "previous_hash": null,
  "record_id": "history_event_example",
  "record_type": "study_history_event",
  "result": "completed",
  "revision": 1,
  "schema_version": "17k-z-r4",
  "session_id": "session_example",
  "source": "apc_native",
  "source_type": "apc_native",
  "updated_at": "2026-06-29T00:00:00Z"
}
